{
  "schema": 1,
  "generated_at": "2026-10-12T18:00:00Z",
  "sources": [
    {
      "id": "aer",
      "name": "American Economic Review",
      "short": "AER",
      "group": "econ-top5",
      "kind": "journal",
      "status": "ok",
      "count": 3,
      "abstract_count": 3,
      "excluded_date_count": 0,
      "errors": [],
      "backends": {
        "crossref": {
          "status": "ok",
          "pages": 1,
          "received": 49,
          "filtered": 4,
          "error": null
        },
        "rss": {
          "status": "not_applicable",
          "pages": 0,
          "received": 0,
          "filtered": 0,
          "error": null
        }
      },
      "enrichment": {
        "pages": 0,
        "requested": 0,
        "matched": 0,
        "filled": 0,
        "cache_hits": 0,
        "deferred": 0,
        "error": null
      }
    },
    {
      "id": "qje",
      "name": "The Quarterly Journal of Economics",
      "short": "QJE",
      "group": "econ-top5",
      "kind": "journal",
      "status": "ok",
      "count": 3,
      "abstract_count": 3,
      "excluded_date_count": 0,
      "errors": [],
      "backends": {
        "crossref": {
          "status": "ok",
          "pages": 1,
          "received": 19,
          "filtered": 1,
          "error": null
        },
        "rss": {
          "status": "ok",
          "pages": 1,
          "received": 15,
          "filtered": 0,
          "error": null
        }
      },
      "enrichment": {
        "pages": 0,
        "requested": 0,
        "matched": 0,
        "filled": 0,
        "cache_hits": 0,
        "deferred": 0,
        "error": null
      }
    },
    {
      "id": "jpe",
      "name": "Journal of Political Economy",
      "short": "JPE",
      "group": "econ-top5",
      "kind": "journal",
      "status": "ok",
      "count": 3,
      "abstract_count": 0,
      "excluded_date_count": 0,
      "errors": [],
      "backends": {
        "crossref": {
          "status": "ok",
          "pages": 1,
          "received": 64,
          "filtered": 9,
          "error": null
        },
        "rss": {
          "status": "ok",
          "pages": 1,
          "received": 19,
          "filtered": 3,
          "error": null
        }
      },
      "enrichment": {
        "pages": 0,
        "requested": 0,
        "matched": 0,
        "filled": 0,
        "cache_hits": 0,
        "deferred": 0,
        "error": null
      }
    },
    {
      "id": "ecta",
      "name": "Econometrica",
      "short": "ECTA",
      "group": "econ-top5",
      "kind": "journal",
      "status": "ok",
      "count": 3,
      "abstract_count": 3,
      "excluded_date_count": 0,
      "errors": [],
      "backends": {
        "crossref": {
          "status": "empty",
          "pages": 1,
          "received": 0,
          "filtered": 0,
          "error": null
        },
        "rss": {
          "status": "ok",
          "pages": 1,
          "received": 14,
          "filtered": 2,
          "error": null
        }
      },
      "enrichment": {
        "pages": 0,
        "requested": 0,
        "matched": 0,
        "filled": 0,
        "cache_hits": 0,
        "deferred": 0,
        "error": null
      }
    },
    {
      "id": "res",
      "name": "The Review of Economic Studies",
      "short": "RES",
      "group": "econ-top5",
      "kind": "journal",
      "status": "ok",
      "count": 3,
      "abstract_count": 3,
      "excluded_date_count": 18,
      "errors": [],
      "backends": {
        "crossref": {
          "status": "ok",
          "pages": 1,
          "received": 54,
          "filtered": 0,
          "error": null
        },
        "rss": {
          "status": "ok",
          "pages": 1,
          "received": 18,
          "filtered": 0,
          "error": null
        }
      },
      "enrichment": {
        "pages": 0,
        "requested": 0,
        "matched": 0,
        "filled": 0,
        "cache_hits": 0,
        "deferred": 0,
        "error": null
      }
    },
    {
      "id": "jf",
      "name": "The Journal of Finance",
      "short": "JF",
      "group": "finance",
      "kind": "journal",
      "status": "ok",
      "count": 3,
      "abstract_count": 3,
      "excluded_date_count": 0,
      "errors": [],
      "backends": {
        "crossref": {
          "status": "ok",
          "pages": 1,
          "received": 38,
          "filtered": 6,
          "error": null
        },
        "rss": {
          "status": "ok",
          "pages": 1,
          "received": 37,
          "filtered": 3,
          "error": null
        }
      },
      "enrichment": {
        "pages": 0,
        "requested": 0,
        "matched": 0,
        "filled": 0,
        "cache_hits": 0,
        "deferred": 0,
        "error": null
      }
    },
    {
      "id": "jfe",
      "name": "Journal of Financial Economics",
      "short": "JFE",
      "group": "finance",
      "kind": "journal",
      "status": "ok",
      "count": 3,
      "abstract_count": 0,
      "excluded_date_count": 18,
      "errors": [],
      "backends": {
        "crossref": {
          "status": "ok",
          "pages": 1,
          "received": 66,
          "filtered": 4,
          "error": null
        },
        "rss": {
          "status": "not_applicable",
          "pages": 0,
          "received": 0,
          "filtered": 0,
          "error": null
        }
      },
      "enrichment": {
        "pages": 0,
        "requested": 0,
        "matched": 0,
        "filled": 0,
        "cache_hits": 0,
        "deferred": 0,
        "error": null
      }
    },
    {
      "id": "rfs",
      "name": "The Review of Financial Studies",
      "short": "RFS",
      "group": "finance",
      "kind": "journal",
      "status": "ok",
      "count": 3,
      "abstract_count": 3,
      "excluded_date_count": 7,
      "errors": [],
      "backends": {
        "crossref": {
          "status": "ok",
          "pages": 1,
          "received": 37,
          "filtered": 0,
          "error": null
        },
        "rss": {
          "status": "ok",
          "pages": 1,
          "received": 8,
          "filtered": 0,
          "error": null
        }
      },
      "enrichment": {
        "pages": 0,
        "requested": 0,
        "matched": 0,
        "filled": 0,
        "cache_hits": 0,
        "deferred": 0,
        "error": null
      }
    },
    {
      "id": "nber",
      "name": "National Bureau of Economic Research",
      "short": "NBER",
      "group": "working-paper",
      "kind": "working-paper",
      "status": "ok",
      "count": 3,
      "abstract_count": 2,
      "excluded_date_count": 0,
      "errors": [],
      "backends": {
        "crossref": {
          "status": "ok",
          "pages": 2,
          "received": 200,
          "filtered": 0,
          "error": null
        },
        "rss": {
          "status": "ok",
          "pages": 1,
          "received": 22,
          "filtered": 0,
          "error": null
        }
      },
      "enrichment": {
        "pages": 0,
        "requested": 0,
        "matched": 0,
        "filled": 0,
        "cache_hits": 0,
        "deferred": 0,
        "error": null
      }
    },
    {
      "id": "feds",
      "name": "Finance and Economics Discussion Series",
      "short": "FEDS",
      "group": "working-paper",
      "kind": "working-paper",
      "status": "ok",
      "count": 3,
      "abstract_count": 3,
      "excluded_date_count": 0,
      "errors": [],
      "backends": {
        "crossref": {
          "status": "ok",
          "pages": 1,
          "received": 62,
          "filtered": 33,
          "error": null
        },
        "rss": {
          "status": "ok",
          "pages": 1,
          "received": 15,
          "filtered": 0,
          "error": null
        }
      },
      "enrichment": {
        "pages": 0,
        "requested": 0,
        "matched": 0,
        "filled": 0,
        "cache_hits": 0,
        "deferred": 0,
        "error": null
      }
    },
    {
      "id": "ecb",
      "name": "European Central Bank Working Papers",
      "short": "ECB WP",
      "group": "working-paper",
      "kind": "working-paper",
      "status": "ok",
      "count": 3,
      "abstract_count": 3,
      "excluded_date_count": 0,
      "errors": [],
      "backends": {
        "crossref": {
          "status": "not_applicable",
          "pages": 0,
          "received": 0,
          "filtered": 0,
          "error": null
        },
        "rss": {
          "status": "ok",
          "pages": 1,
          "received": 15,
          "filtered": 1,
          "error": null
        }
      },
      "enrichment": {
        "pages": 0,
        "requested": 0,
        "matched": 0,
        "filled": 0,
        "cache_hits": 0,
        "deferred": 0,
        "error": null
      }
    },
    {
      "id": "bis",
      "name": "BIS Working Papers",
      "short": "BIS WP",
      "group": "working-paper",
      "kind": "working-paper",
      "status": "ok",
      "count": 3,
      "abstract_count": 3,
      "excluded_date_count": 4,
      "errors": [],
      "backends": {
        "crossref": {
          "status": "not_applicable",
          "pages": 0,
          "received": 0,
          "filtered": 0,
          "error": null
        },
        "rss": {
          "status": "ok",
          "pages": 1,
          "received": 25,
          "filtered": 0,
          "error": null
        }
      },
      "enrichment": {
        "pages": 0,
        "requested": 0,
        "matched": 0,
        "filled": 0,
        "cache_hits": 0,
        "deferred": 0,
        "error": null
      }
    },
    {
      "id": "bfi",
      "name": "Becker Friedman Institute Working Papers",
      "short": "BFI WP",
      "group": "working-paper",
      "kind": "working-paper",
      "status": "disabled",
      "count": 0,
      "abstract_count": 0,
      "excluded_date_count": 0,
      "errors": [],